Concesionario,Direccion,Responsable,Celular,Distrito,DiaVisita,Promotor,Cono
MANGUERAS ALFA - CS,Av San Juan Mz A1 Lt 06 Mateo,,,CHORRILLOS,VI,8,16
MANTENIMIENTOS DE VEHICULOS SAMARA EIRL,Av El Truiunfo Mz K Lt 13  umamarca,,,CHORRILLOS,VI,8,16
MECANICA AUTOMOTRIZ M Y S-CH,"AV. EL TRIUNFO MZ.F, LT11",,,CHORRILLOS,VI,8,16
MEC¡NICA AUTOMOTRIZ PEDRO - CS,AV. VISTA ALEGRE MZ.J LT.3 STA. ISABEL,,,CHORRILLOS,VI,8,16
MECANICA EL CHAVO- SJM-CH.,AV. EL TRIUNFO MZ. F LT. 11 SJM,,,CHORRILLOS,VI,8,16
MOTOREPUESTOS PEREZ - CS,Av Jose Olaya ComitÈ 10 Sta Isabel de Vi,,,CHORRILLOS,VI,8,16
MOTTA IMPORT PARTS SJM - CS,Av los Heroes 661,,,CHORRILLOS,VI,8,16
MULTILLANTAS EL PIURANO-CH,"AV. GUARDIA CIVIL MZ.M, LT.8 LA CAMPI—A ",,,CHORRILLOS,VI,8,16
NEUMATICOS & ENERGIABONY SAC - CH,"AV. SAN JUAN MZ.A, LT.10 AA.HH. TUPAC AM",,,CHORRILLOS,VI,8,16
REPUESTOS FLOR-CH,"MZ.E1, LT.8, TUPAC AMARU DE",,,CHORRILLOS,VI,8,16
REPUESTOS LUCHO-CH,PSJE. VICTOR A. BELAUNDE 198 SJ.L,,,CHORRILLOS,VI,8,16
REPUESTOS RAMIREZ - CS,"AV. SAN JUAN CMTE.43, MZ.G1, LT.4",,,CHORRILLOS,VI,8,16
REPUESTOS RENZO CAR II - CHORRILLOS,"AV. SAN JUAM MZF, LT14 AA.HH TUPAC AMARU",,,CHORRILLOS,VI,8,16
RPTOS. LUBRIC. Y FACTORÕA SAN JUAN LIMA,FALCONIERE ARROYO VARGAS,,,CHORRILLOS,VI,8,16
SERV. ELECT. AUT. E. HUAMANI,"AA.HH EL INTI MZ.A, LT.05",,,CHORRILLOS,VI,8,16
SERVICIO ELECTRICO ALEX-CH,"MZ.A, LT17 NAVIDAD DE VILLA",,,CHORRILLOS,VI,8,16
TECNIJUAN - CHORRILLOS,"AV. SAN JUAN DE LA LIBERTAD  MZ.Y, LT2",,,CHORRILLOS,VI,8,16
WILLY MOTORS ,"AV,. SAN JUAN MZ.B, LT.17 TUPAC VILLA",,,CHORRILLOS,VI,8,16
REPUESTOS JULIO CESAR - 16CO,"AV. SAN JUAN MZ. A1, LT 5, PJ. MATEO",,,CHORRILLOS,VI,8,16
REPUESTOS RENZO-16CO,"AV. SAN JUAN MZ.B, LT.1B MATEO PUMACAHUA",,,CHORRILLOS,VI,8,16
PANAMERICAN BEARNING SAC - 16CO,"MZB1, LT11 AA.HH MATEO PUMACAHUA",,,CHORRILLOS,VI,8,16
BOTICA CORAZON DE JESUS - CHORRILLOS,"AV. SANTA ROSA MZ.D, LT4 M. PUMACAHUA",,,CHORRILLOS,VI,8,16
LUBRICENTRO EL GATO - CHORRILLOS,AA.HH SAN JUAN DE LA LIBERTAD ,,,CHORRILLOS,VI,8,16
REPUESTOS B PIMENTEL - CH,"AV. SAN JUAN CMT.43 MZG1, LT4A TUPAC AMARU",,,CHORRILLOS,VI,8,16
REPUESTOS ANCAHS CHORRILLOS,"AV. SAN JUAN MZ.B, LT.11 MATEO",,,CHORRILLOS,VI,8,16
IMPORTACIONES ROSALES,AV EL TRIUNFO KM 13 MZ S LT 7 COOP. UMAM,,,CHORRILLOS,VI,8,16
REPUESTOS ABANTO - SJM/CH,AV. EL TRIUNFO O PANA. 16 KM.14.5,,,CHORRILLOS,VI,8,16
MULTISERVICIOS VANESITA - CHORRILLOS,"AV. SAN JUAN MZS, LT17",,,CHORRILLOS,VI,8,16
DISTRIBUIDOR JJB - CS,Av San Juan Mz E 11 Lt 9 Tupac ,,,CHORRILLOS,VI,8,16
ACCESORIOS CHOQUECAR,AV EX HUAYLAS MZ E LT 3 ASOC. SARITA COL,,,CHORRILLOS,SA,8,16
AUTOACCESORIOS ALEXIS-CH,"AV. SAN JUAN DE LA LIBERTAD MZ.D1, LT.13",,,CHORRILLOS,SA,8,16
AUTOBOUTIQUE Y REPUESTOS BENY CH.,AV. DEFENSORES DEL MORRO MZ.A LT.10,,,CHORRILLOS,SA,8,16
AUTOPARTES CALED - CS,AV. DEFENSORES DEL MORRO MZ. A LT. 16,,,CHORRILLOS,SA,8,16
BATERIAS EL GATO - CS,Av. Defensores del Morro Mz. A-B  Lt. 16,,,CHORRILLOS,SA,8,16
BOTICA KAORI FARMA - CHORRILLOS,"AV. PRINCIPAL MZ H2, LT16 AA.HH SAN GENA",,,CHORRILLOS,SA,8,16
BOTICA SANTA ROSA - CS,Mz A Lt 62 Villa Municipalidad,,,CHORRILLOS,SA,8,16
COMERCIAL M Y F  II- CHORRILLOS,"AV. DEFENSORES DEL MORRO MZ.D, LT.56 SAR",,,CHORRILLOS,SA,8,16
FACTORI VENTAS Y SERVICIOS SAC-CH,AV. DEFENSORES DEL MORRO SOLAR LT.8,,,CHORRILLOS,SA,8,16
FELIX CAR - CS,Av. ProlongaciÛn Huaylas Mz. D Lt. 32 Ch,,,CHORRILLOS,SA,8,16
LUBRICENTRO EDU - CS,AV. SANTA ANITA 361 URB. VILLA MARINA -CHORRILLOS,,,CHORRILLOS,SA,8,16
LUBRICENTRO Y MECANICA BENJAMIN - CH,"AV. LOS HORIZONTES MZ.N1, LT.4 LOS HUERT",,,CHORRILLOS,SA,8,16
MULTISERVICIOS MARILU,MZ C LOTE 1 AAHH VICTOR RAUL,,,CHORRILLOS,SA,8,16
REPUESTOS DAVID - CS,ALAMEDA 16 MZ. B LT. 15 AS. PV. LOS INC,,,CHORRILLOS,SA,8,16
REPUESTOS NAZCA - CHORRILLOS - CS,Av  Camino Del Inca 150,,,CHORRILLOS,SA,8,16
REPUESTOS NINO - CS,PROLONG. HUAYLAS 04 DE DICIEMBRE MZ A LT,,,CHORRILLOS,SA,8,16
AFINAMIENTO ELECTRONICO AMERICO - SJL,"MZA, LT1 ANDRES A. CACERES SJL",,,SAN JUAN DE LURIGANCHO,LU,8,16
IMPORTACIONES REYNOSO II,"AV. WIESSE MZA, LT41 AA.HH 5 DE NOVIEMBRE SJM",,,SAN JUAN DE LURIGANCHO,LU,8,16
PUNTO DE VENTA OF PRINCIPAL - CC,-,,,LIMA,,10,14
LUBRICANTES SARITA COLONIA - CC,Av Colonial 2091,Janet Chahuara Quispe,,CALLAO,LU,10,14
LUBRICANTES Y REPUESTOS CRUZE DE CHALPON,Av Colonial 4515,Wilberto Franco Vazquez,,CALLAO,LU,10,14
CASA DE CAMBIO EL CHINO - CC,Av Colonial 4559,Lady Soraya Hijar Romero,,CALLAO,LU,10,14
AUTOMOTRIZ MAICELO - CC,Av La Marina 850 La Perla -,Felipe Javier Maicelo Espejo,994271128,LA PERLA,LU,10,14
IMPORTACIONES VALENZUELA ROJAS  - CC,Av La Marina 826 - La Perla,Ludger Reyna Rios,980160093,LA PERLA,LU,10,14
GRIFO JUAN PABLO II - CC,Av La Marina 3805  La Perla,Patricia Bejarano Farias,,LA PERLA,LU,10,14
LIBRERÕA ZEMIRUTH - CC,Mercado Trabajadores Unidos F-25 Bellavi,Nicanor Torres Lopez,,BELLAVISTA,LU,10,14
CORPORACION KDK EIRL,Av La Marina 810 - La Perla,Lazaro Cahuana Fuentes,993928465,LA PERLA,LU,10,14
Z & J COMERCIAL SRL MEC¡NICA - CC,AV. JOS… LEAL N∫ 1274,,,LINCE,JU,10,14
DUPLICADOS  NATURAL - OFICINA PRINCIPAL,CALLE NATALIO SANCHEZ 220 OF.704,AUTOSEGURO AFOCAT,,LINCE,,10,14
MULT. PILLKOCAR SRL - CC,Av La Paz 1674 San Miguel,RAQUEL MONTERO RAMIREZ,,SAN MIGUEL,MA,10,14
LUBRI14 CAR VEL SAC| - CC,Av La Paz 2900-2904 San Miguel,Hercullano Erenesto Velasquez Prieto,,SAN MIGUEL,MA,10,14
L Y S AUTOMOTRIZ SRL - CC,Calle Mariscal Cacere 116 San Miguel,Leoncio Edigzon Espinoza Vega,,SAN MIGUEL,MA,10,14
INYECTRONIC BALDEON  - CC,Av Universitario 610 Pando,Sara Elena Baldeon Huayllullo,,SAN MIGUEL,VI,10,14
VERANSA CORREDORES DE SEGUROS S.A.C. - C,CAL. LOS JAZMINES NRO. 407 DPTO. 501,HERMES DE LA CRUZ VERANO  YAMILA,4219739,LINCE,VI,10,14
LUBRI14 AUTOSPORTING - CC,Av de Rafael Escando 149-,Luis Alberto Espejo Mereno,,SAN MIGUEL,MA,10,14
ARTURO ANDIA LOPEZ  - CC,Av. Francisco Pizarro 757 Rimac,,,RIMAC,VI,10,14
LIBRERÕA BAZAR YOSHIMITZU - CC,Av Boliar 862 P. Libre,Diaz Toguchi John Paul,998756148,PUEBLO LIBRE,MI,10,14
LUBRI14 JANET E.I.R.L. - CC,Av. Naciones Unidas 1695 Lima,JANET LEON AGUIRRE,825*9230,LIMA,MI,10,14
LUBRI14 TECNICOS UNIDOS - CC,Av. Bolivar 1299 Pueblo Libre,LUCIA CAHUANA QUIJANO,,PUEBLO LIBRE,VI,10,14
LUBRICANTES ARA - CC,Jr Castilla 1031 Magdalena,Rojas Rojas Melecio,945550422,MAGDALENA DEL MAR,MA,10,14
ESTUDIO FOTOGR¡FICO - SAN FRANCISCO- CC,Ca. Felipe Arancibia N∞ 525,Sra. Manuela Carrillo Rodriguez,996667672,RIMAC,VI,10,14
LUBRICANTE HUERTA,Av. CAjatambo 179,Ernesto Huerta,,RIMAC,VI,10,14
SERVIMOTORS,Av. Francisco Pizarro 823,Efrain Aguilar Sanchez,,RIMAC,VI,10,14
CONVERSIONES SERPE GAS,AV. RIVA AG‹ERO 2081,RUTH GUTIERREZ,,SAN MIGUEL,MA,10,14
MINIMARKET OASIS,JR. HUAMACHUCO 1500,MARCO ANTONIO BARRENECHEA VERAMENDI,,JESUS MARIA,JU,10,14
MECANICA AUTOMOTRIZ HR,JR. ORBEGOSO 630,HUGO REVOLLEDO HUAJAICACHACC,,BRE—A,VI,10,14
MECANICA AUTOMOTRIZ JADAM,AV. ARICA 1131,EDWIN YOSHI ALOR VILCHEZ,,BRE—A,,10,14
FABIS COMUNICACIONES E.I.R.L,AV. VENEZUELA 853,ROBERTO FACUNDO VILELA,991088495,BRE—A,MI,10,14
LUBRI14  CHOCHES,AV. LA PAZ 2700,HECTOR LLACSA CORNEJO,,SAN MIGUEL,MA,10,14
JP CARS,JR. LEONCIO PRADO 1098,ELIZABETH GONZALES GALVEZ,,MAGDALENA DEL MAR,MA,10,14
LOCUTORIO NOVATEL,AV. RAFAEL ESCARDO 451 MARANGA,FRANCO  QUIROZ SOTO,,SAN MIGUEL,MA,10,14
VTA DE REP. Y SERV. ELEC. ABRAHAM,ELMER FAUCCET 498 URB. LA COLONIAL II,ABRAHAM GARCIA,99830467,SAN MIGUEL,MA,10,14
PUNTO DE VENTA CORPORATIVO - CC,CALLE NATALIO SANCHEZ 220 OF.704,AUTOSEGURO AFOCAT,,LINCE,,10,14
SERVICIOS INFORMATICOS B & F,JR. HUASCAR 1527,NESTOR PROSPERO MORALES ALEJANDRO,943728456,JESUS MARIA,JU,10,14
REPUESTOS VEHICULARES LEON,AV. LA MARINA 2990,JORGE LEON PONCE,992477531,SAN MIGUEL,MA,10,14
FACTORIA EL SOL,AV.SAN LORENZO DE ENCALADA 358(EX CAJATA,SIMON DAMIAN —U—URE VARGAS,980135007,RIMAC,VI,10,14
REPUESTOS Y LUBRICANTES ALEXANDER,GREGORIO PAREDES 423 ALT. CUADRA 2 DE 28,MAXIMA GRACIELA ASTORGA PORRAS,,LIMA,MI,10,14
FACTORIA VERA QUIROZ,AV. LA PAZ 2414,EDUARDO VERA QUIROZ,,SAN MIGUEL,MA,10,14
BODEGA LUZ ELENA,LAS CALEZAS 250,ELENA IZAGUIRRE GUZMAN,997134470,RIMAC,VI,10,14
J & A CORPORACION PANDA E.I.R.L.,JR. REAL AUDIENCIA 585 EL MANZANO,BLANCA SALAS MENDOZA,,RIMAC,VI,10,14
TALLER TALAVERA,JR. ARICA 130 - LA PERLA,ENRIQUE TALAVERA BUITRON,133*509,LA PERLA,,10,14
AUTO RACING PART,Av La Paz 1095 San miguel,AUTO RACING PART,,SAN MIGUEL,MA,10,14
FACTORIA  G & M,PEZET Y MONET 1954,ENRIQUE FEBRES BAYES,,LINCE,JU,10,14
SERVICIOS NUNA,JR. IQUIQUE 236-A LA PERLA,CESAR EDUARDO ESPINOZA GARCIA,,LA PERLA,LU,10,14
REDIMSA - CC,AV. MORALES DUAREZ 2877,DENIS MARI√ëO A√ëAYO,,LIMA,VI,10,14
INTERNET CYBERT NANDO - CC,AV. ALACAZAR 460,MIGUEL ANGEL CONTRERAS DAVIRAN,986629365,RIMAC,VI,10,14
REPU17RA LYG,AV. LA MARINA 3367,LIDONIL DIAZ RUBIO,,SAN MIGUEL,MA,10,14
CASA DE CAMBIO BONANZ,JR. HUASCAR 1523,RAFAEL LLANO RAMIREZ,,JESUS MARIA,JU,10,14
HL AUTOS S.A.,PEDRO PASCUAL FARFAN 1130 CERCADO DE LIM,HUGO LOPEZ CRUZ,,LIMA,MI,10,14
LUBRICANTES ROSARIO,NAPO 535,JOHNNY DURAND SALAZAR,,BRE—A,MI,10,14
CORPORACION FIMAVI,JR. AIJA 398,MARISOL ORE BALLARIA,,BRE—A,MI,10,14
SERVICIO ELECTRICO ALEXANDRA,JR. ZORRITOS 725,ALEX RAMIREZ RIOS,,BRE—A,MI,10,14
REPUESTOS DARRIOLA,AV. TINGO MARIA 1101,DANIEL ARRIOLA AYALA,,BRE—A,MI,10,14
EBBASSA MOTOR¥S EIRL,AV. ARICA 1405,BERTHA SERRANO TAPIA,954847486,BRE—A,MI,10,14
BODEGA BAZAR NI—O JESUS,AV. ARNALDO MARQUEZ 525,MARIA ESTHER VALLE GUZMAN,332-1636,JESUS MARIA,JU,10,14
LUBRICANTES Y ADITIVOS LECCASA,AV. JOSE GALVEZ 1150 LA PERLA,LUCY LECCA SALAS,,LA PERLA,LU,10,14
"REPUESTOS ""WILLY""",JR. ARICA 282 ( AV. GRAU(EX.- AV. BUENOS,ZENON PAUCAR PIO,,LA PERLA,VI,10,14
FERRETERIA HANAN S.A,AV. JUAN V. ALVARADO MZ. H-2 LT. 15 URB.,ANA DEL ROSARIO CUNIBERTI TERRONES,,CALLAO,LU,10,14
BOTICA SAN JUAN MACIAS,JR. RAMON CARCAMO 409,NEIL SANDRO TELLO SORIA,,LIMA,MI,10,14
LUBRICANTES JHON,AV VENEZUELA  1421 - BELLAVISTA,BECKET JHON QUI—ONES PAREDES,,BELLAVISTA,LU,10,14
COMERCIAL REY DE PAZ,AV. COLONIAL 2180,AUGUSTO FELIX ESPEJO MARQUEZ,,LIMA,MI,10,14
REPUESTOS Y LUBRICANTES AMERICA,JR. LORETO 1626,LUCY MENDOZA SIFUENTES DE SANDOVAL,,BRE—A,VI,10,14
MECANICA AUTOMOTRIZ SAN JUDAS TADEO,AV SANCHO DAVILA 300 URB EL BOSQUE,CARMEN ROSA GALINDO AMARO,987822197,RIMAC,VI,10,14
PANADERIA LAS VEGAS,AV. MARIANO CORNEJO 797,PATRICIA NIETO CARDENAS,,PUEBLO LIBRE,VI,10,14
REPUESTOS AUTOMOTRICES TO—O,CALLE SAN BRUNO 295 URB. SANTA FLORENCIA,JORGE PAZ PARADA,,MAGDALENA DEL MAR,MA,10,14
EL SPA DEL AUTOMOVIL,AV. JOSE GALVEZ 1376 BELLAVISTA,WALTER GASTON ROMERO CESPEDES,946094320,LA PERLA,LU,10,14
LUBRI14 LA FLORIDA,AV. AMANCAES NRO 249 URB. LA FLORIDA,ERNESTO HUERTAS MALLQUI,,RIMAC,,10,14
AGENCIA LA BUENA SUERTE,AV. REYNALDO SAAVEDRA NRO 2583,LORENZO HUAQUI AMARU,,LIMA,MI,10,14
OLEO14 EL PACIFICO,AV. ARICA NRO  1987,EDSON GUSTAVO HUERTA PAUCAR,,LIMA,MI,10,14
BODEGA EL PAISA,AV. GUZMAN BLANCO 231,LUIS CRUZADO IDA—EZ,987050168,LIMA,MI,10,14
AUTOGOL TOURS,JR. GUZMAN Y BARRON 2436 CERCADO DE LIMA,EVELYN RAQUEL CHAVES FLORES,988236188,LIMA,MI,10,14
TAXI NUEVO SAN JUAN,GUZMAN Y BARRON 2498,ALICIA NINA APAZA,998513628,LIMA,MI,10,14
GLOBAL BRIGHT SAC,JR. LAS ESMERALDAS NRO. 2513 URB. SAN GA,EDITH MIRIAM VILLANUEVA GAMEZ,,LIMA,MI,10,14
INVERSIONES VELOX MOTORS SAC,AV. LA MARINA 998,ROSSANA QUISPEALAYA MEZA,,PUEBLO LIBRE,VI,10,14
CORPORACION AUTOMOTRIZ CORDOVA E HIJOS,RAFAEL ESCARDO 195,VICENTE CORDOVA GARCIA,994054306,SAN MIGUEL,MA,10,14
EMP. DE TRANSP. Y SERV. GALLEGOS U. HNOS,JR. ELEAZAR GUZMAN Y BARRON 2431-CERCADO,FELIX H GALLEGOS URDANIVIA,991163265,LIMA,MI,10,14
GM CONVERSIONES SAC,AV. COLONIAL 1703 - CERCADO DE LIM,GRETA GARDENIA ROMERO HUAMAN,,LIMA,MI,10,14
PROMOTOR ELIZABETH,,,,JESUS MARIA,,10,14
CASA DE CAMBIO A & E,AV. VENEZUELA 1234 URB. CHACRA,SONIA TAME VILCA,,BRE—A,MI,10,14
COMERCIAL EL REY,JR. FRANCISCO ORELLANA 300,JOSE MANUEL SILVA CAJUSOL,,BRE—A,MI,10,14
AUTO PARTES LUIS,AV. ARICA 2069 A.H. TRABAJADORES MUNICIP,REGINO LIMACHI CARITA,,LIMA,MI,10,14
JESSICA SILVA,AV. VENEZUELA 1359 BRE—A,JESICA YANEY SILVA VALDIVIEZO,,BRE—A,MI,10,14
MICAS JULY,AV. JOSE GALVEZ 1377,JULIETT GUZMAN AGUILAR,,LA PERLA,LU,10,14
ELECTRO AUTOMOTRIZ LINCE Y SER. GEN.,AV. PROLONGACION IQUITOS 1698,JAIME MALCA DIAZ,,LINCE,JU,10,14
FOTO COPIA LIBRERIA,PROLONG. BUENOS AIRES 2177 CALLAO,JULIO FRANK FIGUEROA RODRIGUEZ,,CALLAO,VI,10,14
LUBRICANTES AROM,AV. MORALES DUAREZ 3297 CERCADO,EVA MUNOZ VILLANUEVA,988101891,LIMA,MI,10,14
TALLER NINO DEL MILAGRO,LIMA,SEGUNDO PAREDES,,RIMAC,VI,10,14
ASESORIA Y CONSULTORIA DE TRASPORTE DINA,AV. GUZMAN Y BARRON 2425,DINA CAMPOS VILLAREAL,,LIMA,MI,10,14
SERVI14 JG,PROL. ARICA 1920 - 1924 CERCADO,JOSE LUIS GALARZA VIDAL,98304603,LIMA,MI,10,14
LLANTERIA MYG GLOBAL SERVICE SAC,AV. BOLIVAR II 349 PUEBLO LIBRE,17BAN MORA MAYTA,981269035,PUEBLO LIBRE,VI,10,14
J Y J FULL SERVICE,AV. COLONIAL 2689 - CALLAO,JOSE CARLOS TORRES ROJAS,,CALLAO,LU,10,14
AUDIO CARS,AV. LA MARINA NRO 404 PUEBLO LIBRE,WILFREDO ROJAS VERGARA,,PUEBLO LIBRE,LU,10,14
C.C W17RN UNION - CALLAO,AV.COLONIAL 48,,,CALLAO,VI,10,14
LUBRI14 CARLOS,AV. JOSE LEAL 1243 LINCE,JULY BEATRIZ NU—EZ ALTAMIRANO,,LINCE,JU,10,14
ELECTRO CAR - AV. LA MARINA 915,AV. LA MARINA 915 - A UNA CUADRA DE BOMB,JUAN MIGUEL LUNA ROSAS,987800054,CALLAO,VI,10,14
T & COPY CENTER,PJE. ANA DE BORJA 148 - ELIO FRENTE A LA,NORMA ELENA DIAZ BALTAZAR,996291887,LIMA,MI,10,14
FOOD MARKET GADEK,Ref. Hospital del nino,,,LIMA,JU,10,14
"AUTOPARTES ""DANIFER""",CALLE SINCHI ROCA 2390 LINCE,JUAN PABLO CULIS LOPEZ,997436329,LINCE,JU,10,14
LOCUTORIO BODEGA ANDRE,AV. COLONIAL 4990 CALLAO BELLAVISTA A LA,SANCHEZ DE BUTRON ANA,999935681,BELLAVISTA,LU,10,14
GRUPO METROMOVIL SAC,ELIAZAR GUZMAN Y BARRON 2410 MZ. B LT. 5,KATHLIN ROXANA MIRANDA DENEGRI,989305163,LIMA,MI,10,14
EUGENIA QUISPE PRADO,AV. OSCAR R. BENAVIDES EX. COLONIAL N. 2,EUGENIA QUISPE PRADO,,CALLAO,VI,10,14
GLADYS ARIAMA CONDORI,JR. CUZCO 389 STAN. 154 LIMA,,999875466,LIMA,LU,10,14
LIBRERIA FATIMA MACARENA,JR. CASTROVIRREYNA 205 BRENA,LUZ ANGELICA CARNERO MONTOYA,945958159,BRE—A,JU,10,14
E&E SERVICIOS E IMPORTACIONES EIRL,AV. UNIVERSITARIA 681 PANDO SAN MIGUEL,ELIANA LOPEZ CARNERO,987530540,SAN MIGUEL,VI,10,14
LUBRI14 PIERO CARS- RIMAC,AV. LA CAPILLA 290 RIMAC,VERONICA VIRGINIA NORIEGA SERRANO,998244027,RIMAC,VI,10,14
MULTISERVICIOS CHRISTIAN,JR. ELEAZAR GUZMAN Y BARRON 2427,CHRISTIAN GIOMAR LOAYZA HERNANDEZ,991142018,LIMA,MI,10,14
B Y GLOBAL ASESORES Y CORREDORES DE SEGU,MZ. E LT 6 URB. VILLA ALEGRE SURCO,DAVID FELIX BALBIN ALIAGA,,SANTIAGO DE SURCO,MA,10,14
POLICLINICO SAN LUIS MEDIC,,,,LOS OLIVOS,LU,10,14
C.C W17RN UNION - LINCE,AV. CANEVARO 619 LINCE,TATIANA LAZARO ACERO,,LINCE,JU,10,14
JUANA GLADES DE LA CRUZ HUAYANAY,AV. UNION JICAMARCA MZ-W.2 LT-19 - LURIG,EMPRESA DE LEVARO,,CHOSICA,LU,10,14
AURORA CAYCHO VIDAL,JR. BOLOGNESI 849 BELLAVISTA CALLAO,,,BELLAVISTA,LU,10,14
RO&JO IMPORT SAC,AV. UNIVERSITARIA 646 SAN MIGUEL,ROSA TORNERO VARGAS,,SAN MIGUEL,VI,10,14
TRANSPORTE JOSELITO,TEOFILO CASTILLO 1702 LIMA,JOSE MORALES AQUINO,,LIMA,MI,10,14
D SPLASH,,,,RIMAC,VI,10,14
MEGA TOURS,ELEAZAR GUZMAN Y BARRON 2412 LIMA,JUANA OCHOA VALLEJOS,,LIMA,MI,10,14
PROCURADOR MEDINA,PROL. PALLARDELLI 427 RETABLO COMAS,ELEUTERIO MEDINA CORONEL,,JESUS MARIA,LU,10,14
HIGH POWER CAR,AV. UNIVERSITARIA 679 URB. PANDO SAN MIG,JOSEFINA LUIS OSORIO,,SAN MIGUEL,VI,10,14
EDUARDO AGUILAR,LIMA,,,PUEBLO LIBRE,LU,10,14
JUAN CARLOS TORRES,SAN MIGUEL,,14593460,SAN MIGUEL,LU,10,14
C.D.B ELECTRIC PARTS E.I.R.L - S.J.M,AV. DEFENSORES DE LIMA 1022,,,SAN JUAN DE MIRAFLORES,LU,9,16
LAVADERO MAGA - CS,"AV. CANEVARO MZ.J,LT.2",,,SAN JUAN DE MIRAFLORES,LU,9,16
LUBRICANTES REPUESTO VIRGINIA - S.J.M,AV. DEFENSORES DE LIMA 1030 San Juan de ,,,SAN JUAN DE MIRAFLORES,LU,9,16
R & F REPREENTACIONES DURAN - S.J.M,AV. PRIMAVERA 2309,,,SAN JUAN DE MIRAFLORES,LU,9,16
REPUESTOS Y MOTORES 200 MILLAS - CS,AV. LOS HEROES 1143 INT. A,,,SAN JUAN DE MIRAFLORES,LU,9,16
AUTOBOUTIQUE M&N - V.E.S,"GRUPO 21A, MZ CH, LT19",,,VILLA EL SALVADOR,LU,9,16
AFINAMIENTO SAN LUIS VMT - CS,Av. 28 de julio 395,,,VILLA MARIA DEL TRIUNFO,LU,9,16
ARTUR CAR - CS,AV. PACHACUTEC 333 ,,,VILLA MARIA DEL TRIUNFO,LU,9,16
ASEPAF - V.M.T,AV. SALVADOR ALLENDE 686 Villa Maria,,,VILLA MARIA DEL TRIUNFO,LU,9,16
AUTO BOUTIQUE MATÕAS - CS,AV. PACHAC⁄TEC 3323 -V.M.T,,,VILLA MARIA DEL TRIUNFO,LU,9,16
AUTOACCESORIOS ISABEL - V.M.T,AV. PACHACUTEC 3477 (FRENTE POSTA ALCIDE,,,VILLA MARIA DEL TRIUNFO,LU,9,16
AUTOBOUTIQUE ELOY CAR(V.M.T),AV. PACHACUTEC 3363,,,VILLA MARIA DEL TRIUNFO,LU,9,16
AUTOBOUTIQUE NICOLETTA - V.M.T,AV. PACHACUTEC 3365 Villa Maria ,,,VILLA MARIA DEL TRIUNFO,LU,9,16
AUTOMOTRIZ SANCHEZ† VMT - CS,AV. 28 DE JULIO 213,,,VILLA MARIA DEL TRIUNFO,LU,9,16
AUTOSERVICIOS EL HUANUQUE—O,AV. PACHACUTEC 3487 (MZ.7 AC),,,VILLA MARIA DEL TRIUNFO,LU,9,16
BAZAR RENE - CS,AV. CARLOS MARIATEGUI N∫ 1712 SAN GABRIEL ,,,VILLA MARIA DEL TRIUNFO,LU,9,16
BOTICA PILIMILI - CS,AV. JOSE OLAYA 614 VALLECITO V.T.M.  REF: MERCADO VALLECITO,,,VILLA MARIA DEL TRIUNFO,LU,9,16
CASA DE CAMBIO SANTIAGO-VMT,AV. PACAHCUTEC 2209,,,VILLA MARIA DEL TRIUNFO,LU,9,16
DAEWOO MOTORS EL CHINO - CS,AV SALVADOR ALLENDE 1165 ,,,VILLA MARIA DEL TRIUNFO,LU,9,16
ESCUELA DE CONDUCTORES DEL PERU,AV. JOSE CARLOS MARIATEGUI 1228 SAN GABR,,,VILLA MARIA DEL TRIUNFO,LU,9,16
FOTO ESTUDIO STAIN V.M.T - CS,AV. PACHACUTEC 2161,,,VILLA MARIA DEL TRIUNFO,LU,9,16
FOTOCOPIAS GUSTAVITO - V.M.T,AV. NICOLAS DE PIEROLA 701 C/SAN JOSE FR,,,VILLA MARIA DEL TRIUNFO,LU,9,16
INTERNET CENTRO-V.M.T,AV. TRIUNFO 389,,,VILLA MARIA DEL TRIUNFO,LU,9,16
LA CASA DEL TORITO MICARI - V.M.T,AV. 28 DE JULIO 397,,,VILLA MARIA DEL TRIUNFO,LU,9,16
LENIN GRAF - CS,AV. PACHACUTEC 3499,,,VILLA MARIA DEL TRIUNFO,LU,9,16
LIBRERIA MULTISERV. ORME—O-SJM,CALLE ELIAS AGUIRRE 118 URB. SAN JUANITO,,,VILLA MARIA DEL TRIUNFO,LU,9,16
LINEA AUTMOTRIZ MULTIMARCAS-V.M.T,AV.  NICOLAS DE PIEROLA C/AV. SOL 652 (P,,,VILLA MARIA DEL TRIUNFO,LU,9,16
LOCUTORIO PROGRESO - CS,JR. PROGRESO N∫ 200 SANTA ROSA ,,,VILLA MARIA DEL TRIUNFO,LU,9,16
LOCUTORIO SANTISIMA CRUZ-VMT,AV. PACHACUTEC 3199,,,VILLA MARIA DEL TRIUNFO,LU,9,16
LUBRICANTES REPUESTOS SAN PABLO - CS,AV. MATEO PUMACAHUA 800,,,VILLA MARIA DEL TRIUNFO,LU,9,16
LUBRICANTES SAGITARIO V.M.T - CS,AV. PACHACUTEC 1986,,,VILLA MARIA DEL TRIUNFO,LU,9,16
LUBRICANTES SANTA ROSA - VMT SAN GABRIEL - CS,Av. Jose Carlos Mariategui 3225 San Gabr,,,VILLA MARIA DEL TRIUNFO,LU,9,16
LUBRICANTES SANTA ROSA VMT,JR. PROGRESO 1898,,,VILLA MARIA DEL TRIUNFO,LU,9,16
LUBRICENTRO FLAMANI - CS,AV. MATEO PUMACAHUA 868 -V.E.S.,,,VILLA MARIA DEL TRIUNFO,LU,9,16
LUBRICENTRO FLORES - CS,AV. MANCO CAPAC N∫ 421 SAN GABRIEL ,,,VILLA MARIA DEL TRIUNFO,LU,9,16
LUBRICENTRO VALDEZ II - VMT,AV. JOSE C. MARIATEGUI 2695 Villa Maria,,,VILLA MARIA DEL TRIUNFO,LU,9,16
MATIZADOS HELDER DE COLORES - CS,AV. NICOL¡S DE PIEROLA 157 EX SALVADOR ALLENDE,,,VILLA MARIA DEL TRIUNFO,LU,9,16
MEY FARMA - CS,AV. LATINOAM…RICA N∫ 664 SAN GABRIEL ,,,VILLA MARIA DEL TRIUNFO,LU,9,16
MINIMARKET SAN JUANITO - V.M.T,AV. LOS HEROES 1109 Villa Maria,,,VILLA MARIA DEL TRIUNFO,LU,9,16
MULTIREPUESTO NACAR - V.M.T,AV. PACHACUTEC 3361 VMT,,,VILLA MARIA DEL TRIUNFO,LU,9,16
MULTISERVICIOS EL TRIUNFO - CS,Av Villa MarÌa 1499 ,,,VILLA MARIA DEL TRIUNFO,LU,9,16
REPRESENTACIONES RAMOS - CS,Jr Progreso 951 Cercado VMT,,,VILLA MARIA DEL TRIUNFO,LU,9,16
REPRESENTACIONES TELEFILM - CS,AV. EL TRIUNFO N∫ 656 ,,,VILLA MARIA DEL TRIUNFO,LU,9,16
REPUESTOS AUTOMOTRIZ DISTRIBUIDORES KOKI,Av Salvador Allende 634,,,VILLA MARIA DEL TRIUNFO,LU,9,16
REPUESTOS CODANI SAC - V.M.T,AV. PACHACUTEC 3221,,,VILLA MARIA DEL TRIUNFO,LU,9,16
REPUESTOS DACOS SAC - V.M.T,AV. SALVADOR ALLENDE 608,,,VILLA MARIA DEL TRIUNFO,LU,9,16
REPUESTOS MAFER - CS,Av de de Diciembre 110 ,,,VILLA MARIA DEL TRIUNFO,LU,9,16
REPUESTOS PUBLICHENCO V.M.T,AV PACHACUTEC 3401,,,VILLA MARIA DEL TRIUNFO,LU,9,16
REPUESTOS SALCEDO EIRL - CS,Av Pachacutec 3277,,,VILLA MARIA DEL TRIUNFO,LU,9,16
REPUESTOS Y ACCESORIOS MADRID-VMT,AV. SALVADOR ALLENDE 230,,,VILLA MARIA DEL TRIUNFO,LU,9,16
SEGURIDAD INTEGRAL DEL PERU-VMT,AV.PACHACUTEC 3500,,,VILLA MARIA DEL TRIUNFO,LU,9,16
SERVICENTRO BERNY PECSA MAX - CS,AV. JULIO C. TELLO 101 ñ SN. GABRIEL ,,,VILLA MARIA DEL TRIUNFO,LU,9,16
SERVICIO EL…CTRICO AUTOMOTRIZ MGN - CS,AV. PRIMAVERA 1129  SN. GABRIEL ALTO ,,,VILLA MARIA DEL TRIUNFO,LU,9,16
SERVICIO ELECTRICO MARIN E.I.R.L - V..M.,AV. SALVADOR ALLENDE 624  Villa Maria,,,VILLA MARIA DEL TRIUNFO,LU,9,16
SERVICIOS ELECTRICOS TITO - CS,Av. JosÈ Carlos MareateguÌ 666,,,VILLA MARIA DEL TRIUNFO,LU,9,16
TALLER BASILIO† VMT - CS,JR. LOS CLAVELES 499,,,VILLA MARIA DEL TRIUNFO,LU,9,16
TECNILLANTAS LUB SR DE LA ASUNCI”N DE P.,CALLE LEONCIO PRADO URB.113 SAN JUANITO,,,VILLA MARIA DEL TRIUNFO,LU,9,16
INSUMOS RONALDO - V.M.T,Sonia Alania Morales,,,VILLA MARIA DEL TRIUNFO,LU,9,16
SERVILLANTAS CHARAPITA - S.J.M,"JR. LEONCIO PRADO MZ.E4, LT01 San Juan d",,,VILLA MARIA DEL TRIUNFO,LU,9,16
 CASA DE CAMBIO ORE-V.M.T,BREKER BRENSON ESTRADA,,,VILLA MARIA DEL TRIUNFO,LU,9,16
AHORRO GAS S.A.C-V.E.S,AV. MATEO PUMACAHUA S/N,,,VILLA EL SALVADOR,MA,9,16
ASOC. DE TAXI ECOLOGICO - CS,"SECT1,GRP-22A,MZ,M-LT,3",,,VILLA EL SALVADOR,MA,9,16
AUTOMOTRIZ NR V.E.S - CS,AV. PASTOR SEVILLA S/N RUTA C REF. A32 C,,,VILLA EL SALVADOR,MA,9,16
AUTOPARTES FERNANDEZ,"AV. PASTOR SEVILLA SECT.1, MZ.CH, LT.19 ",,,VILLA EL SALVADOR,MA,9,16
AUTOSERVICIOS LUBRICANTES MARSON - V.E.S,"AV. PASTOR SEVILLA SECT.2, GR.26, MZ.J, ",,,VILLA EL SALVADOR,MA,9,16
BOTICA ANGEL FAR-V.E.S,"AV. REVOLUCION SECT.2, MZ.G, LT.21",,,VILLA EL SALVADOR,MA,9,16
CENTRO DE LAVADO SANCHEZ-V.E.S,"SECT2,GR.23A, MZ.N, LT2",,,VILLA EL SALVADOR,MA,9,16
CENTRO DE LUBRICACION -REPUESTOS TAMARA ,"SECT.6, GR.1, MZ.E, LT.13",,,VILLA EL SALVADOR,MA,9,16
CENTRO DE LUBRICACION TAMARA 2 - V.E.S,AV EL SOL SECT. 1 GRUPO 25 MZ F LT 1 - V,,,VILLA EL SALVADOR,MA,9,16
COPIAS V.E.S - CS,"AV. CESAR VALLEJO SECT.3,MZ.P,LT.4",,,VILLA EL SALVADOR,MA,9,16
ELECTROMECANICA PALOMINO VES,"SECT. 10,GR.2,MZ.K,LT.1 OASIS DE VILLA",,,VILLA EL SALVADOR,MA,9,16
ESMEF S.A.C - V.E.S,"AV. 1∫ MAYO C/ PASTOR SEVILLA SECT1,GR.2",,,VILLA EL SALVADOR,MA,9,16
EXTINTORES PRINCE,"AV. PASTOR SEVILLA GR.21,SECT.1,MZ.G,LT.",,,VILLA EL SALVADOR,MA,9,16
FOTO ESTUDIO GERAL V.E.S - CS,AV. REVOLUCION TDA.18 1ER. PISO FRE,,,VILLA EL SALVADOR,MA,9,16
FRENOS LAZARO - V.E.S,"AV. PASTOR SEVILLA MZ.E, LT24 Villa El S",,,VILLA EL SALVADOR,MA,9,16
GRIFO REPSOL V.E.S - CS,"SECT.23,GR.19,MZ.M,LT.1 MICAELA BASTIDAS",,,VILLA EL SALVADOR,MA,9,16
INVERSIONES LOS INCAS - V.E.S,"AV. MATEO PUMACAHUA MZ.D, LT1 ",,,VILLA EL SALVADOR,MA,9,16
J Y H AUTOMOTRIZ ( AYHUASI) - CS,"AV. 1 DE MAYO SECT.1 GR.17,MZ.G, LT.13",,,VILLA EL SALVADOR,MA,9,16
LA MALVINA II - V.E.S,"AV. 1 DE MAYO MZA, LT16",,,VILLA EL SALVADOR,MA,9,16
LAVADO DE AUTOS J Y J V.E.S - CS,"AV. PASTOR SEVILLA SECT.1, GR.25A, LT.19",,,VILLA EL SALVADOR,MA,9,16
LAVADO DE AUTOS LAS PALMERAS V.E.S - CS,"AV. PASTOR SEVILLA SECT.1,GR.25A MZ.M LT",,,VILLA EL SALVADOR,MA,9,16
LIBRERIA BAZAR ALEXANDER - CS,"SECT.3,GR.7,MZ.M,LT.17",,,VILLA EL SALVADOR,MA,9,16
LUBRICANTES CAMARENA - CS,AV MICAELA BASTIDAS SEC3 GR.23 MZ.J LT24,,,VILLA EL SALVADOR,MA,9,16
LUBRICANTES CAMARENA II-V.E.S,AV. MICAELA BASTIDAS C/AV. 3 OCTUBRE SEC,,,VILLA EL SALVADOR,MA,9,16
LUBRICANTES CAPRICORNIO-V.E.S,AV. PASTOR SEVILLA C/VELASCO ALVARADO CD,,,VILLA EL SALVADOR,MA,9,16
LUBRICANTES NICO V.E.S - CS,"AV. PASTOR SEVILLA MZ.CH, LT.22",,,VILLA EL SALVADOR,MA,9,16
LUBRICANTES RAUL V.E.S - CS,"AV. PASTOR SEVILLA SECT.2,GR.26,MZ.I, LT",,,VILLA EL SALVADOR,MA,9,16
LUBRICANTES Y ACCESORIOS OIL MOTORS -VES,"C/REVOLUCION SECT.3, GR.16, MZ.A, LT.13 ",,,VILLA EL SALVADOR,MA,9,16
LUBRICENTRO CESAR-V.E.S ,"AV. PASTOR SEVILLA MZ.E, LT.11, GR.21A 4",,,VILLA EL SALVADOR,MA,9,16
LUBRICENTRO DENZEL,AV. ALAMOS C/ EL SOL GRUPO 11 MZ N LT 5,,,VILLA EL SALVADOR,MA,9,16
LUBRICENTRO HUAUYA-V.E.S,"AV. 1∫ DE MAYO SECT.1, GR.22, MZ.I, LT.1",,,VILLA EL SALVADOR,MA,9,16
LUBRICENTRO NUBIA V.E.S,"AV. MARIATEGUI SECT.3,GR.15, MZ.B, LT.15",,,VILLA EL SALVADOR,MA,9,16
LUBRICENTRO VILA HNOS. - V.E.S,"AV. PASTOR SEVILLA C/ARRIBA PERU SECT2, ",,,VILLA EL SALVADOR,MA,9,16
MULTILLANTAS Y LUBRICENTRO R&D VES - CS,"Av. Pastor Sevilla SECT.1,GR.22A,MZ.L LT",,,VILLA EL SALVADOR,MA,9,16
MULTISERVICIOS  HOBEB - V.E.S,"AV. REVOLUCION SECT.2,GR.15,MZ.O, LT.5",,,VILLA EL SALVADOR,MA,9,16
MULTISERVICIOS CAMPOS V.E.S,"AV. PASTOR SEVILLA SECT3, MZ.J, LT28 Vil",,,VILLA EL SALVADOR,MA,9,16
PERNOS CENTRO MIGUELITO I I VES,"AV PASTOR SEVILLA SECT1 GR21A,MZ.J,LT12",,,VILLA EL SALVADOR,MA,9,16
REPUESTOS HERNAN V.E.S - CS,"SECT.2, GR.21, MZ.J,LT.17",,,VILLA EL SALVADOR,MA,9,16
SERVICIO RADIADORES EL REY V.E.S - CS,PASTOR SEVILLA MZI LT 5,,,VILLA EL SALVADOR,MA,9,16
TALLER MECANICA NEW CAR¥S 16 - CS,"SECT.1,GR.25,MZ.J,LT.23",,,VILLA EL SALVADOR,MA,9,16
VULCANIZADORA CHINCHAY - CS,AV.MICAELA BASTIDASST.22A LT.A,,,VILLA EL SALVADOR,MA,9,16
VULCANIZADORA NU—EZ V.E.S - CS,AV. REVOLUCION 2494,,,VILLA EL SALVADOR,MA,9,16
REPUESTOS NAZCA-V.E.S,"AV. PASTOR SEVILLA MZ. L, LT. 13 (FRENTE",,,VILLA EL SALVADOR,MA,9,16
BOTICA RESIDENCIAL V.E.S - CS,"SCT 6 GRP,Z-MZ,N-LT,12",,,VILLA EL SALVADOR,MA,9,16
ESCUELA DE CONDUCTORES ELI CAR SAC - VES,AV.VELASCO C/AV. MARIELENA MOYANO S/N,,,VILLA EL SALVADOR,MA,9,16
BOTICA¥S FARMA WASI-V.E.S,"AV. PASTOR SEVILLA C/3 DE OCTUBRE,SCT3,G",,,VILLA EL SALVADOR,MA,9,16
AUTOPARTES ACCESORIOS JHITO - V.E.S,"AV. MICAELA BASTIDAS MZF, LT14A",,,VILLA EL SALVADOR,MA,9,16
MULTISERVICIOS 200 MILLAS - CS,SECT.3 GPO.18 MZ.F LT.21,,,VILLA EL SALVADOR,MA,9,16
AGENCIA DE EMPLEOS ENTEL PERU,JR. SAMUEL VILLARAN 225 CIUDAD DE DIOS ,,,SAN JUAN DE MIRAFLORES,MI,9,16
AUDIO VIDEO SRL - S.J.M,CALLE GABRIEL TORRES 122A  San Juan de M,,,SAN JUAN DE MIRAFLORES,MI,9,16
AUTOMOTRIZ BERNAOLA SJM - CS,AV. PASTOR SEVILLA MZ. G LT.05-06,,,SAN JUAN DE MIRAFLORES,MI,9,16
BATERIACENTRO EL POZO - VES - CS,AV LOS HEROES 321A,,,SAN JUAN DE MIRAFLORES,MI,9,16
BATERIAS JULIO,AV. SALVADOR ALLENDE 1004,,,SAN JUAN DE MIRAFLORES,MI,9,16
BOTICA VIDA FARMA,"AV. MIGUEL IGLESIAS MZ.G, LT.5",,,SAN JUAN DE MIRAFLORES,MI,9,16
